{
  "$schema": "http://json-schema.org/draft-07/schema#",
  "$id": "https://raw.githubusercontent.com/RebelliousSmile/schema-in-the-mist/v1.1.0/schemas/v1/otherscape/character-trope.schema.json",
  "type": "object",
  "properties": {
    "name": {
      "default": "Untitled Character Trope",
      "description": "The Character Trope's name, as printed under its category heading.",
      "examples": [
        "Neon Exorcist",
        "Corporate Fixer",
        "Street Samurai"
      ],
      "type": "string",
      "minLength": 1,
      "pattern": "\\S"
    },
    "category": {
      "description": "The heading this Character Trope is printed under, which groups tropes that play in similar territory. **This does not hold a themebook** and does not resolve against `category` on an :Otherscape Theme Kit or Theme: same word, different subject. A themebook names where a theme comes from; this names a family of characters. Where a kit reference does mean a themebook — inside `theme_kits` and `choices` — the field is spelled `category` there too, and that one *is* the themebook.",
      "examples": [
        "ASSASSINS & SPIES",
        "HACKERS & FIXERS",
        "SOLDIERS"
      ],
      "type": "string"
    },
    "description": {
      "description": "The prose that introduces this Character Trope: who they are and what kind of trouble they walk into. Supports inline Markdown; use `\\n\\n` for paragraph breaks.",
      "examples": [
        "You were trained to put things back where they belong, and the things do not agree."
      ],
      "type": "string"
    },
    "theme_kits": {
      "description": "The Theme Kits this Character Trope hands the player outright, in the order they are printed. Each is held as a title-tag-plus-themebook pair rather than a string, because the printed form — `Chipped Weapon Mastery (AUGMENTATION)` — carries two data, and reading it as one would leave a consumer parsing parentheses.",
      "type": "array",
      "items": {
        "type": "object",
        "properties": {
          "title_tag": {
            "type": "string",
            "minLength": 1,
            "pattern": "\\S",
            "description": "The referenced Theme Kit's title tag, transcribed from the unparenthesised half of the printed line. Spelled `title_tag` rather than `name` because that is the field an :Otherscape Theme Kit actually carries, so this half of the pair is a lookup key rather than fresh vocabulary.",
            "examples": [
              "Chipped Weapon Mastery",
              "Corporate Citizenship"
            ]
          },
          "category": {
            "type": "string",
            "minLength": 1,
            "pattern": "\\S",
            "description": "The referenced Theme Kit's themebook, transcribed from the parenthesised half of the printed line. Needed alongside the title tag because the same title tag can appear under more than one themebook across settings, so neither half alone identifies a kit. Same field, same spelling as `category` on an :Otherscape Theme Kit — and note that it is **not** the same field as `category` on this trope, which holds a grouping of tropes instead.",
            "examples": [
              "AUGMENTATION",
              "AFFILIATION",
              "ARTIFACT",
              "CYBERSPACE"
            ]
          }
        },
        "required": [
          "title_tag",
          "category"
        ],
        "additionalProperties": false,
        "description": "A reference to an :Otherscape Theme Kit, held as the pair the books print: title tag plus themebook. The two keys are spelled exactly as they are on `otherscape/theme-kit`, so the pair resolves against a kit record without a mapping table and without parsing parentheses."
      }
    },
    "choices": {
      "description": "The Theme Kits printed under `Choose One:`, from which the player takes a single one. Same shape as `theme_kits` because the books print them in the identical form; what separates the two lists is that this one is picked from, not taken whole.",
      "type": "array",
      "items": {
        "type": "object",
        "properties": {
          "title_tag": {
            "type": "string",
            "minLength": 1,
            "pattern": "\\S",
            "description": "The referenced Theme Kit's title tag, transcribed from the unparenthesised half of the printed line. Spelled `title_tag` rather than `name` because that is the field an :Otherscape Theme Kit actually carries, so this half of the pair is a lookup key rather than fresh vocabulary.",
            "examples": [
              "Chipped Weapon Mastery",
              "Corporate Citizenship"
            ]
          },
          "category": {
            "type": "string",
            "minLength": 1,
            "pattern": "\\S",
            "description": "The referenced Theme Kit's themebook, transcribed from the parenthesised half of the printed line. Needed alongside the title tag because the same title tag can appear under more than one themebook across settings, so neither half alone identifies a kit. Same field, same spelling as `category` on an :Otherscape Theme Kit — and note that it is **not** the same field as `category` on this trope, which holds a grouping of tropes instead.",
            "examples": [
              "AUGMENTATION",
              "AFFILIATION",
              "ARTIFACT",
              "CYBERSPACE"
            ]
          }
        },
        "required": [
          "title_tag",
          "category"
        ],
        "additionalProperties": false,
        "description": "A reference to an :Otherscape Theme Kit, held as the pair the books print: title tag plus themebook. The two keys are spelled exactly as they are on `otherscape/theme-kit`, so the pair resolves against a kit record without a mapping table and without parsing parentheses."
      }
    },
    "loadout": {
      "description": "The gear this Character Trope starts with, transcribed from the printed `Loadout:` line one entry at a time. Plain strings, qualifiers kept inside them: the line is prose about gear rather than a list of catalog keys, and the group-wide riders it uses — `(all: incriminating)` — do not belong to any single item. These strings deliberately do **not** resolve against `otherscape/loadout-item`: a trope's loadout is a starting suggestion written in the trope's own words, while a loadout item is a catalog record, and keeping the two unlinked means neither has to wait on the other.",
      "type": "array",
      "items": {
        "type": "string",
        "minLength": 1,
        "pattern": "\\S",
        "description": "One entry of the starting `Loadout:` line, transcribed as printed, parentheticals included.",
        "examples": [
          "sniper rifle (requires setup) with AR sight",
          "concealed pistol (all: incriminating)"
        ]
      }
    },
    "meta": {
      "description": "Attribution and cataloging fields for the Character Trope's origin.",
      "type": "object",
      "properties": {
        "publication_type": {
          "default": "homebrew",
          "description": "Classifies the Character Trope's source to aid cataloging and tooling.",
          "examples": [
            "official",
            "homebrew"
          ],
          "type": "string",
          "enum": [
            "official",
            "third_party",
            "cauldron",
            "homebrew"
          ]
        },
        "source": {
          "description": "Source title (book, supplement, PDF) where this Character Trope appears.",
          "examples": [
            "Metro:Otherscape - Core Book",
            "Tokyo:Otherscape - Setting Book"
          ],
          "type": "string"
        },
        "authors": {
          "description": "List of credited authors or contributors.",
          "type": "array",
          "items": {
            "type": "string",
            "minLength": 1,
            "pattern": "\\S",
            "description": "One credited author name.",
            "examples": [
              "Son of Oak",
              "4rtamis"
            ]
          }
        },
        "page": {
          "description": "Page number (if relevant to the source).",
          "examples": [
            64,
            72
          ],
          "type": "integer",
          "minimum": 1,
          "maximum": 9007199254740991
        }
      },
      "additionalProperties": false
    }
  },
  "additionalProperties": false,
  "description": ":Otherscape - Character Trope, the character-creation package the books print: a name under a category heading, prose, the Theme Kits it hands over, the ones it offers a choice between, and a starting loadout. It has no counterpart in Legend in the Mist, so nothing here maps onto a `litm/` target."
}
